<?xml version="1.0" encoding="UTF-8"?>
<motorguide-response xmlns="http://www.thrustcurve.org/2014/MotorGuideResponse" xmlns:xsi="http://www.w3.org/2001/XMLSchema-instance" xsi:schemaLocation="http://www.thrustcurve.org/2014/MotorGuideResponse http://www.thrustcurve.org/2014/motorguide-response.xsd">
    <criteria>
        <matches>280</matches>
    </criteria>
    <results ok-count="5" failed-count="7">
        <result>
            <status>ok</status>
            <motor-id>20</motor-id>
            <manufacturer>Estes Industries</manufacturer>
            <manufacturer-abbrev>Estes</manufacturer-abbrev>
            <designation>C5</designation>
            <common-name>C5</common-name>
            <thrust-to-weight>4.984858067159761</thrust-to-weight>
            <simulations-run>1</simulations-run>
            <liftoff-time>0.03</liftoff-time>
            <burnout-time>1.73</burnout-time>
            <apogee-time>7.279999999999983</apogee-time>
            <max-acceleration>190.5519096951878</max-acceleration>
            <guide-velocity>15.913868995492022</guide-velocity>
            <max-velocity>61.25736811606941</max-velocity>
            <burnout-altitude>69.199747904822</burnout-altitude>
            <max-altitude>229.35653572550592</max-altitude>
            <optimal-delay>5.549999999999983</optimal-delay>
        </result>
        <result>
            <status>ok</status>
            <motor-id>36</motor-id>
            <manufacturer>AeroTech</manufacturer>
            <manufacturer-abbrev>AeroTech</manufacturer-abbrev>
            <designation>D24T</designation>
            <common-name>D24</common-name>
            <thrust-to-weight>12.872827748447863</thrust-to-weight>
            <simulations-run>1</simulations-run>
            <liftoff-time>0.009000000000000001</liftoff-time>
            <burnout-time>0.9</burnout-time>
            <apogee-time>10.80000000000002</apogee-time>
            <max-acceleration>339.0240956360988</max-acceleration>
            <guide-velocity>23.280520841790448</guide-velocity>
            <max-velocity>147.44221449496052</max-velocity>
            <burnout-altitude>88.56031720292509</burnout-altitude>
            <max-altitude>669.5412682222425</max-altitude>
            <optimal-delay>9.90000000000002</optimal-delay>
        </result>
        <result>
            <status>ok</status>
            <motor-id>739</motor-id>
            <manufacturer>AeroTech</manufacturer>
            <manufacturer-abbrev>AeroTech</manufacturer-abbrev>
            <designation>D10W</designation>
            <common-name>D10</common-name>
            <thrust-to-weight>12.311992869048206</thrust-to-weight>
            <simulations-run>1</simulations-run>
            <liftoff-time>0.01</liftoff-time>
            <burnout-time>1.385</burnout-time>
            <apogee-time>10.890000000000022</apogee-time>
            <max-acceleration>205.96157816548836</max-acceleration>
            <guide-velocity>17.637565084427315</guide-velocity>
            <max-velocity>137.25511162170062</max-velocity>
            <burnout-altitude>130.94129416479478</burnout-altitude>
            <max-altitude>655.1655375118384</max-altitude>
            <optimal-delay>9.505000000000022</optimal-delay>
        </result>
        <result>
            <status>ok</status>
            <motor-id>33</motor-id>
            <manufacturer>AeroTech</manufacturer>
            <manufacturer-abbrev>AeroTech</manufacturer-abbrev>
            <designation>D13W</designation>
            <common-name>D13</common-name>
            <thrust-to-weight>12.35162946312653</thrust-to-weight>
            <simulations-run>1</simulations-run>
            <liftoff-time>0.01</liftoff-time>
            <burnout-time>1.7</burnout-time>
            <apogee-time>11.150000000000025</apogee-time>
            <max-acceleration>202.9084551625239</max-acceleration>
            <guide-velocity>20.225234201325</guide-velocity>
            <max-velocity>146.08959051357414</max-velocity>
            <burnout-altitude>184.72047574736234</burnout-altitude>
            <max-altitude>711.1774670044884</max-altitude>
            <optimal-delay>9.450000000000026</optimal-delay>
        </result>
        <result>
            <status>ok</status>
            <motor-id>35</motor-id>
            <manufacturer>AeroTech</manufacturer>
            <manufacturer-abbrev>AeroTech</manufacturer-abbrev>
            <designation>D21T</designation>
            <common-name>D21</common-name>
            <thrust-to-weight>20.394324259558566</thrust-to-weight>
            <simulations-run>1</simulations-run>
            <liftoff-time>0.009399999999999999</liftoff-time>
            <burnout-time>0.94</burnout-time>
            <apogee-time>11.049400000000022</apogee-time>
            <max-acceleration>292.7761827185242</max-acceleration>
            <guide-velocity>22.564510489810782</guide-velocity>
            <max-velocity>161.258131234474</max-velocity>
            <burnout-altitude>98.27863701274039</burnout-altitude>
            <max-altitude>721.6995745020256</max-altitude>
            <optimal-delay>10.109400000000022</optimal-delay>
        </result>
    </results>
</motorguide-response>